"serial_no","chapter_name","paragraph_number","paragraph","Word_Count","Sentance_Count","Stop_Words","Post_INFO"
"1057","Ten","67","Ish  nodded  as  the  Australian  batsman  reverted  to  the  crease.  Ganguly  had kept the winning score of 384 required by the Australians at a tantalising level - difficult yet possible. Australians could have played safe and taken the game to a draw, but that is not how Australians play.","50","3","21","{""NOUN"": 11, ""VERB"": 13, ""ADP"": 4, ""DET"": 8, ""ADJ"": 4, ""PRT"": 2, ""NUM"": 1, ""."": 2, ""ADV"": 3, ""CONJ"": 2}"
"1058","Ten","68","'Hey  Mr  Mathematician,  has  it  happened?  Has  it  ever  happened  that  the  side facing  a  follow-on  actually  won  the  match?'  Ish  said.  He  signalled  Omi  to  start urgent, special prayers.","33","4","9","{""PRT"": 3, ""NOUN"": 9, ""."": 2, ""VERB"": 8, ""PRON"": 3, ""ADV"": 2, ""ADP"": 1, ""DET"": 3, ""ADJ"": 2}"
"1059","Ten","69","I  pulled  out  the  cricket  data  book  from  the  top  shelf.  We  hardly  sold  any  of these,  but  the  publisher  insisted  we  keep  a  few  copies 'Ok,  so  it  has  happened earlier,' I said after a ten-minute search.","42","2","17","{""PRON"": 5, ""VERB"": 7, ""PRT"": 2, ""DET"": 7, ""NOUN"": 7, ""ADP"": 4, ""ADJ"": 3, ""ADV"": 2, ""."": 4, ""CONJ"": 1}"
"1060","Ten","70","'How many times?' Ish said, eyes glued to screen.","11","2","1","{""ADV"": 1, ""ADJ"": 1, ""NOUN"": 3, ""PRT"": 2, ""VERB"": 3, ""."": 1}"
"1061","Ten","71","'Twice,' I said and noticed Omi close his eyes and chant silently.","14","1","3","{""NOUN"": 4, ""."": 2, ""PRON"": 2, ""VERB"": 3, ""CONJ"": 2, ""ADV"": 1}"
"1062","Ten","72","'See, it happens. Twice in how long?' Ish said.","11","3","3","{""NUM"": 1, ""."": 1, ""PRON"": 1, ""VERB"": 2, ""ADV"": 2, ""ADP"": 1, ""ADJ"": 1, ""PRT"": 1, ""NOUN"": 1}"
"1063","Ten","73","'Twice in the last hundred and ten years.' Ish turned to me. 'Only twice?' 'Once  in  1894  and  then  in  1981,'  I  read  out  loud  from  the  page.  'Both  times, England  won  against,  guess  who,  Australia.  Sorry  buddy,  but  statistically speaking, this match is so over.' Ish nodded.","58","7","20","{""NOUN"": 13, ""ADP"": 6, ""DET"": 3, ""ADJ"": 4, ""CONJ"": 3, ""PRT"": 4, ""VERB"": 5, ""PRON"": 3, ""ADV"": 6, ""."": 9, ""NUM"": 2}"
"1064","Ten","74","'Like the probability is so low that I'd say if India wins, I will sponsor the Goa trip,' I joked.","24","1","7","{""ADP"": 3, ""DET"": 2, ""NOUN"": 4, ""VERB"": 7, ""ADV"": 1, ""ADJ"": 1, ""PRON"": 3, ""."": 3}"
"1065","Ten","75","'Or like if India wins, you will start believing in God?' Omi played along.","16","2","4","{""NOUN"": 5, ""ADP"": 3, ""VERB"": 4, ""."": 1, ""PRON"": 1, ""PRT"": 2}"
"1066","Ten","76","'Yep,' I said.","5","1","0","{""NUM"": 1, ""."": 2, ""PRON"": 1, ""VERB"": 1}"
"1067","Ten","77","I told Omi to stop praying too much. A draw would be fine. Ganguly probably did not know the odds. The worst would be if Australia did score the runs.","30","4","10","{""PRON"": 1, ""VERB"": 11, ""NOUN"": 7, ""PRT"": 1, ""ADV"": 4, ""ADJ"": 2, ""DET"": 3, ""ADP"": 1}"
"1068","Ten","78","'161/3,' Omi read Australia's score at tea, which coincided with our own break.","17","1","5","{""NUM"": 1, ""."": 3, ""NOUN"": 5, ""VERB"": 2, ""PRT"": 1, ""ADP"": 2, ""DET"": 1, ""PRON"": 1, ""ADJ"": 1}"
"1069","Ten","79","'Let's  clean  up  the  shop,  guys.  The  match  gets  over  in  a  few  hours.  We  may have some customers,' I said. 'A draw is fine. We will take the Australians another time.' Ish reluctantly picked up the mop.","44","6","13","{""NOUN"": 11, ""PRT"": 3, ""ADJ"": 3, ""ADP"": 2, ""DET"": 7, ""."": 5, ""VERB"": 9, ""PRON"": 3, ""ADV"": 1}"
"1070","Ten","80","Day 5 - Post-tea The  Indian  team  must  have  mixed  something  special  in  their  tea.  Australia came  back  and  continued  to  cruise  at  166/3.  Then  came  five deadly  overs  that included  a  hattrick  from  Harbhajan  Singh.  Next  stop,  Australia  174/8.  In  eight runs, half of the Australian team was gone.","52","5","12","{""NOUN"": 17, ""NUM"": 5, ""."": 3, ""DET"": 4, ""ADJ"": 4, ""VERB"": 9, ""ADP"": 5, ""PRON"": 1, ""ADV"": 2, ""CONJ"": 1, ""PRT"": 1}"
"1071","Ten","81","'Ish,  don't  fucking  stand  in  front  of  the  TV,'  I  said.  But  Ish  wasn't  standing, only jumping.","23","2","6","{""NOUN"": 4, ""."": 4, ""VERB"": 7, ""ADV"": 3, ""ADP"": 2, ""DET"": 1, ""PRON"": 1, ""CONJ"": 1}"
"1072","Ten","82","'Fuck  your  statistics  man,  fuck  the  probability,'  Ish  shouted  in  jubilation.  I don't like it when people insult mathematics, but I gave Ish the benefit of doubt.","32","2","9","{""VERB"": 7, ""PRON"": 4, ""NOUN"": 10, ""."": 4, ""DET"": 2, ""ADP"": 2, ""ADV"": 2, ""CONJ"": 1}"
"1073","Ten","83","You are allowed a few celebratory curses when you witness history.","11","1","5","{""PRON"": 2, ""VERB"": 3, ""DET"": 1, ""ADJ"": 1, ""NOUN"": 3, ""ADV"": 1}"
"1074","Ten","84","Pretty  soon,  the  last  two  batsmen  were  scalped as  well.  Harbhajan,  the  Surd that  Ish  kissed  on  screen  (and  left  saliva  marks  all  over),  took  six  wickets,  and India won the match in the most spectacular way ever.","44","2","15","{""ADV"": 6, ""."": 6, ""DET"": 5, ""ADJ"": 2, ""NUM"": 2, ""NOUN"": 11, ""VERB"": 6, ""ADP"": 4, ""CONJ"": 2}"
"1075","Ten","85","In  Eden  Gardens,  every  placard,  every  poster  and  anything  combustible besides people was on fire. It was impossible to hear the TV commentary, as the crowds roared everytime an Indian team member's name was announced.","39","2","10","{""ADP"": 4, ""NOUN"": 13, ""."": 3, ""DET"": 5, ""CONJ"": 1, ""ADJ"": 3, ""VERB"": 6, ""PRON"": 1, ""PRT"": 2, ""ADV"": 1}"
"1076","Ten","86","Ish  stood  tall,  his  hands  on  his  hips  and  looked  at  the  screen.  I  could  see genuine  love  in  his  eyes.  Every  now  and  then,  I  had  seen  Ish  watch  the  men  in blue as if he wished he was one of them. But today, he didn't have any of his own regrets.  I  think  more  than  wanting  to  be  them,  he  wanted  them  to  win.  He  saw Harbhajan jump and jumped along. He clapped when Ganguly came to accept the trophy.","87","7","40","{""NOUN"": 16, ""VERB"": 21, ""ADJ"": 4, ""."": 4, ""PRON"": 16, ""ADP"": 10, ""CONJ"": 4, ""DET"": 4, ""ADV"": 4, ""NUM"": 1, ""PRT"": 3}"
"1077","Ten","87","'Two balls quickly please, we have a match,' a boy plonked a fifty-rupee note on the counter. The first customer of the great Indian Cricket Season had arrived.","31","2","10","{""PRT"": 1, ""NOUN"": 8, ""ADV"": 1, ""VERB"": 5, ""."": 3, ""PRON"": 1, ""DET"": 6, ""ADJ"": 4, ""ADP"": 2}"
"1078","Ten","88","I folded my hands and looked at the sky. Thank you God, for the miracles you bestow on us.","20","2","9","{""PRON"": 5, ""VERB"": 3, ""NOUN"": 5, ""CONJ"": 1, ""ADP"": 3, ""DET"": 2, ""."": 1}"
"1079","Ten","89","'We have come to offer solutions, not just sell some balls,' I started.","16","1","5","{""NOUN"": 3, ""VERB"": 5, ""PRT"": 1, ""."": 3, ""ADV"": 2, ""DET"": 1, ""PRON"": 1}"
"1080","Ten","90","I had delivered my first line perfect. The preparations until two last night better be  worth  it,  I  told  myself.  We  were  in  the  principal's  office  in  the  Kendriya Vidyalaya.  The office  wasin  a  poor  state,  with  rickety  furniture  and  dusty trophies.  Like  most  government  offices  and  buildings  old  files  piled  up  high  on several cupboards. The lady principal and six teachers sat around a semicircular wooden table. It must be miserable to work here, I thought. It must be miserable to work for anyone else, I thought again.","94","8","27","{""PRON"": 10, ""VERB"": 16, ""ADJ"": 13, ""NOUN"": 23, ""DET"": 7, ""ADP"": 8, ""NUM"": 2, ""ADV"": 4, ""."": 4, ""PRT"": 4, ""CONJ"": 3}"
"1081","Ten","91","'Go on,' the principal said, as my pause for effect became too long.","16","1","6","{""NOUN"": 4, ""ADP"": 3, ""."": 3, ""DET"": 1, ""VERB"": 2, ""PRON"": 1, ""ADV"": 2}"
"1082","Ten","92","'So  we  have  a  district-level  champion  player who  can  design  a  package  based on your needs and budgets,' I pointed at Ish and every teacher looked at him.","30","1","13","{""ADP"": 4, ""PRON"": 5, ""VERB"": 6, ""DET"": 3, ""ADJ"": 1, ""NOUN"": 7, ""CONJ"": 2, ""."": 2}"
"1083","Ten","93","I passed out sheets  that estimated the school's monthly needs based on eight hundred students. I had them laser printed at a computer shop for three rupees a page. A peon brought samosas and tea for everyone.","38","3","12","{""PRON"": 3, ""VERB"": 6, ""PRT"": 2, ""NOUN"": 13, ""DET"": 4, ""ADJ"": 1, ""ADP"": 4, ""NUM"": 3, ""ADV"": 1, ""CONJ"": 1}"
"1084","Ten","94","'How much will this cost?' the administrative head said.","10","2","3","{""ADV"": 2, ""VERB"": 2, ""DET"": 2, ""NOUN"": 2, ""."": 1, ""ADJ"": 1}"
"1085","Ten","95","'We did  some calculations.  Your average  cost will  be ten  thousand a month,'  I said.","17","2","5","{""NOUN"": 4, ""VERB"": 6, ""DET"": 2, ""ADJ"": 1, ""NUM"": 1, ""."": 2, ""PRON"": 1}"
"1086","Ten","96","'That's  too  much.  This  is  a  Kendriya  Vidyalaya.  Not a  private  school,'  the administrative head said. He shut the notebook and pushed it towards me.","28","4","9","{""DET"": 6, ""VERB"": 5, ""ADV"": 2, ""ADJ"": 3, ""NOUN"": 5, ""."": 2, ""PRON"": 3, ""CONJ"": 1, ""ADP"": 1}"
"1087","Ten","97","I took a deep breath. I had thought of an answer for this scenario. 'Sir, we can scale down.' Ish interupped me, 'It is twelve rupees per child a month. Don't you think sport deserves as much as the cost of a fountain pen?' The teachers looked up from their notebooks and exchanged glances.","59","6","22","{""PRON"": 6, ""VERB"": 13, ""DET"": 7, ""ADJ"": 3, ""NOUN"": 14, ""ADP"": 6, ""."": 4, ""PRT"": 2, ""ADV"": 3, ""CONJ"": 1}"
"1088","Ten","98","'Frankly,  no.  We  get  judged  on  our  results.  The  pass  percentage  and  the  first divisions. We have limited resources,' the head said.","25","4","7","{""ADV"": 1, ""."": 3, ""DET"": 4, ""PRON"": 3, ""VERB"": 4, ""ADP"": 1, ""NOUN"": 6, ""CONJ"": 1, ""ADJ"": 2}"
"1089","Ten","99","'If everyone thinks that way, where will India's sportsmen come from?' Ish said.","16","2","4","{""NUM"": 1, ""NOUN"": 5, ""VERB"": 4, ""DET"": 1, ""."": 2, ""ADV"": 1, ""PRT"": 1, ""ADP"": 1}"
"1090","Ten","100","'From rich families.' The head took out his glasses and wiped ihem calmly.","14","2","3","{""NUM"": 1, ""ADJ"": 1, ""NOUN"": 4, ""PRT"": 2, ""DET"": 1, ""VERB"": 3, ""PRON"": 1, ""CONJ"": 1}"
"1091","Ten","101","'But talent is not distributed only among the rich. We have to expand the pool.' 'Do you know half our classrooms leak in the rain,' the head said. 'Should we get shiny balls or fix the leaks?' He stood up to leave.","46","5","17","{""PRT"": 7, ""NOUN"": 7, ""VERB"": 12, ""ADV"": 2, ""ADP"": 2, ""DET"": 6, ""ADJ"": 2, ""PRON"": 5, ""."": 2, ""CONJ"": 1}"
"1092","Ten","102","I  mentally  said  the  F-word  a  few  times.  C'mon  Govind,  save  this. You  need business, any business, 'Sir, we can do a plan for five thousand a month,' I said.","36","3","11","{""PRON"": 4, ""ADV"": 1, ""VERB"": 6, ""DET"": 6, ""NOUN"": 9, ""ADJ"": 1, ""."": 7, ""ADP"": 1, ""NUM"": 1}"
"1093","Ten","103","Ish raised a hand to keep me quiet. I could have killed him.","13","2","5","{""NOUN"": 2, ""VERB"": 5, ""DET"": 1, ""PRT"": 1, ""PRON"": 3, ""ADJ"": 1}"
"1094","Ten","104","Ish stood up, to match the admin head's height. 'What are you here to do?' 'To give children an education,' the head said with a straight face.","32","3","12","{""NOUN"": 7, ""VERB"": 6, ""ADV"": 2, ""."": 4, ""PRT"": 3, ""DET"": 4, ""ADJ"": 3, ""PRON"": 2, ""ADP"": 1}"
"1095","Ten","105","'And  all  the  education  is  in  these  books  they  read  under  the  plastered  roofs?","14","1","8","{""NUM"": 1, ""DET"": 4, ""NOUN"": 3, ""VERB"": 2, ""ADP"": 2, ""PRON"": 1, ""ADJ"": 1}"
"1096","Ten","106","What about the education that comes from sports?' 'What?' the admin head said.","15","3","5","{""PRON"": 1, ""ADP"": 2, ""DET"": 4, ""NOUN"": 3, ""VERB"": 2, ""PRT"": 1, ""."": 1, ""ADJ"": 1}"
"1097","Ten","107","'Sit down Jitin sir,' the principal said. 'Let us hear what they have to say.' Jitin-sir, I mentally noted his name as he sat down again.","30","3","11","{""PRT"": 5, ""NOUN"": 4, ""."": 3, ""DET"": 1, ""VERB"": 6, ""PRON"": 6, ""ADJ"": 1, ""ADV"": 3, ""ADP"": 1}"
"1098","Ten","108","'Are you teaching your kids a subject called teamwork? Are you teaching them how  to  chase  a  goal  with  passion?  Are  you  teaching  them  discipline?  Are  you teaching  them  focus?'  Ish  asked.  I  stamped  his  foot,  signalling  him  to  sit  down.","43","6","17","{""ADP"": 2, ""PRON"": 11, ""VERB"": 11, ""NOUN"": 11, ""DET"": 2, ""ADV"": 1, ""PRT"": 3, ""."": 2}"
"1099","Ten","109","But he ignored me.","4","1","2","{""CONJ"": 1, ""PRON"": 2, ""VERB"": 1}"
"1100","Ten","110","'What are you talking about?' This from one of the teachers, 'Sports teaches them all this. And tell me, who will be more successful in life?","29","3","15","{""DET"": 5, ""VERB"": 5, ""PRON"": 4, ""ADP"": 4, ""."": 3, ""NUM"": 1, ""NOUN"": 4, ""CONJ"": 1, ""ADV"": 1, ""ADJ"": 1}"
"1101","Ten","111","The  kid  who  knows  all  the  chemical  formulae  or  the  one  who  knows  teamwork, passion, discipline and focus?' 'Sit down, son,' the principal said. Ish took his seat but did not keep quiet.","39","3","13","{""DET"": 5, ""NOUN"": 12, ""PRON"": 3, ""VERB"": 6, ""CONJ"": 3, ""NUM"": 1, ""."": 6, ""PRT"": 2, ""ADV"": 1}"
"1102","Ten","112","'I'm not setding for a scaled-down  version. Eight hundred  kids and they want to  keep  them  locked  in  classes  all  day.  We  will  chase  useless  first  divisions  but not spend two samosa plates worth of money on sports.' He  pointed  to  the  samosas  on  the  plate.  All  the  teachers  stopped  eating midway. The pause continued until the principal spoke again. 'Fine, ten thousand is ok for a trial. Let's see how it goes. You are on for six months.' We stood up to shake hands. Six educated, fifty-somethings stood up to shake hands with me. Yes, I had become a real businessman.","110","12","38","{""PRT"": 10, ""PRON"": 10, ""VERB"": 24, ""ADV"": 5, ""ADP"": 11, ""DET"": 10, ""ADJ"": 6, ""NOUN"": 24, ""CONJ"": 2, ""NUM"": 4, ""."": 3, ""X"": 1}"
"1103","Ten","113","'If  this  works,  why  don't  you  come  to  a  meeting  at  our  Belapur  school?'  the oldest gentleman in the group said.","24","2","11","{""ADP"": 3, ""DET"": 4, ""NOUN"": 6, ""."": 2, ""ADV"": 2, ""VERB"": 3, ""PRON"": 2, ""PRT"": 1, ""ADJ"": 1}"
"1104","Ten","114","'Oh, yes. This is Mr Bhansali, headmaster of the Belapur school. He came for a visit, so I asked him to sit in this meeting,' the principal introduced.","33","3","11","{""NUM"": 1, ""."": 5, ""X"": 1, ""DET"": 5, ""VERB"": 5, ""NOUN"": 8, ""ADP"": 4, ""PRON"": 3, ""PRT"": 1}"
"1105","Ten","115","I took his card. I mentally made a note to order business cards and wondered if I could do the fist pumping now or save it for later.","28","2","11","{""PRON"": 5, ""VERB"": 7, ""NOUN"": 6, ""ADV"": 3, ""DET"": 2, ""PRT"": 1, ""CONJ"": 2, ""ADP"": 2}"
"1106","Eleven","1","Goa, wow! Someone has a good life,'  Vidya said with a pin in her mouth. She stood on a stool in her room, fixing a poster of Aamir Khan in Dil Chahta Hai on the wall. I, her tutor, held the pin tray. So much for my position of authority.","56","5","20","{""NOUN"": 21, ""."": 6, ""VERB"": 5, ""DET"": 6, ""ADJ"": 1, ""ADP"": 9, ""PRON"": 6, ""ADV"": 2}"
"1107","Eleven","2","'Goa is your brother's idea. I really don't need this break from work,' I said.","19","2","5","{""."": 3, ""VERB"": 4, ""PRON"": 3, ""NOUN"": 4, ""PRT"": 1, ""ADV"": 2, ""DET"": 1, ""ADP"": 1}"
"1108","Eleven","3","'Of course, you do,' she said as she stepped down. 'It will help you get over the earthquake.' 'What will help me get over the earthquake is work, and the money I make to pay back those loans. This trip is costing us three thousand bucks.' I came back to her desk.","58","5","22","{""ADJ"": 1, ""NOUN"": 11, ""."": 4, ""PRON"": 9, ""VERB"": 15, ""ADP"": 3, ""ADV"": 3, ""DET"": 6, ""PRT"": 4, ""CONJ"": 1, ""NUM"": 1}"
"1109","Eleven","4","She  took  her  seat,  opened  her  book  and  slapped  each  page  as  she  turned  it over.","17","1","8","{""PRON"": 5, ""VERB"": 4, ""NOUN"": 3, ""."": 1, ""CONJ"": 1, ""DET"": 1, ""ADP"": 1, ""PRT"": 1}"
"1110","Eleven","5","'Can you act more interested?' 'I am not a good actor,' she said.","17","2","6","{""VERB"": 4, ""PRON"": 3, ""ADV"": 2, ""ADJ"": 2, ""PRT"": 2, ""DET"": 1, ""NOUN"": 1, ""."": 2}"
"1111","Eleven","6","""Very  funny.  So  did  you  do  the  calculus  chapter  in  your  so-called  self-study mode.' 'I did self-study as you did not have time for me,' she said.","32","3","15","{""."": 3, ""ADV"": 3, ""ADJ"": 3, ""VERB"": 6, ""PRON"": 6, ""DET"": 1, ""NOUN"": 5, ""ADP"": 3, ""PRT"": 2}"
"1112","Eleven","7","'Anyway,  I don't understand  it. As  usual,  I  suck. What  is  all this  ""dx dt"", and why are they so many scary symbols?' 'Vidya,  you  are  appearing  for  medical  entrance.  Don't  talk  like...,'  I  stopped mid-sentence.  I  opened  the  calculus  chapter.  Some  spoilt  brats  have  to  be spoonfed even the basics.","63","7","18","{""ADV"": 6, ""."": 9, ""PRON"": 8, ""VERB"": 14, ""ADP"": 3, ""ADJ"": 6, ""DET"": 5, ""NOUN"": 9, ""CONJ"": 1, ""PRT"": 2}"
"1113","Eleven","8","'Don't talk like what?' 'Like a duffer. Now pay attention.' 'I am not a duffer. Just go to Goa, manage your business, make money, insult people  who  don't  salivate  for  maths  and  don't  make  any  time  for  friends.  I  can manage fine.' The last word 'fine' had the loudest volume.","61","7","17","{""VERB"": 15, ""ADV"": 5, ""ADP"": 3, ""PRON"": 5, ""."": 6, ""DET"": 5, ""NOUN"": 15, ""PRT"": 3, ""CONJ"": 1, ""ADJ"": 3}"
"1114","Eleven","9","'Excuse me. Is there a problem?' I said after a pause.","12","3","5","{""ADP"": 2, ""PRON"": 2, ""VERB"": 2, ""ADV"": 1, ""DET"": 2, ""NOUN"": 2, ""PRT"": 1}"
"1115","Eleven","10","'Yes, calculus problems. Can we please start?' I explained calculus to her for an hour. 'Try the exercises in the end. And read the next chapter by the time I come back,' I said as I finished class.","42","5","12","{""NUM"": 1, ""."": 4, ""CONJ"": 2, ""NOUN"": 8, ""VERB"": 8, ""PRON"": 6, ""PRT"": 2, ""ADP"": 4, ""DET"": 5, ""ADJ"": 1, ""ADV"": 1}"
"1116","Eleven","11","She kept quiet.","3","1","0","{""PRON"": 1, ""VERB"": 1, ""ADJ"": 1}"
"1117","Eleven","12","'Vidya, why is it that sometimes making you talk is like extracting teeth.' I am  like  this  only,  you  have  a  problem?  Only  you  have  the  right  to  ignore people?'  she  threw  back.  Her  eyes  turned  moist  and  her  long  fingers  trembled.","46","5","19","{""NOUN"": 8, ""."": 2, ""ADV"": 3, ""VERB"": 13, ""PRON"": 8, ""ADP"": 3, ""PRT"": 4, ""DET"": 3, ""CONJ"": 1, ""ADJ"": 1}"
"1118","Eleven","13","Before moisture turned to rain, I had to exit.","10","1","3","{""ADP"": 1, ""NOUN"": 1, ""VERB"": 4, ""PRT"": 2, ""."": 1, ""PRON"": 1}"
"1119","Eleven","14","'I'll be back in four days,' I said as I headed to the door. 'Who cares?' she said from behind me.","26","3","8","{""PRT"": 4, ""PRON"": 5, ""VERB"": 5, ""ADV"": 1, ""ADP"": 4, ""NUM"": 1, ""NOUN"": 3, ""."": 2, ""DET"": 1}"
"1120","Eleven","15","'Eat on time and don't stay up late,' said Ali's dad as the train signal went off.","21","1","7","{""VERB"": 5, ""ADP"": 2, ""NOUN"": 4, ""CONJ"": 1, ""ADV"": 3, ""."": 2, ""PRT"": 2, ""DET"": 1, ""ADJ"": 1}"
"1121","Eleven","16","Ali was too excited to care for his dad's instructions. He reserved the top berth for himself and climbed up. Omi said his pre-journey prayers.","26","3","11","{""NOUN"": 7, ""VERB"": 6, ""ADV"": 1, ""PRT"": 3, ""ADP"": 2, ""PRON"": 4, ""DET"": 1, ""ADJ"": 1, ""CONJ"": 1}"
"1122","Eleven","17","'Ali's ammi doesn't care. He is a piece of my heart,' Ali's dad said and his eyes became moist. 'Sometimes I wish I had not married again.' I  wrapped  the  cash  and  tickets  in  plastic  and  placed  it  inside  my  socks.","47","4","16","{""NOUN"": 12, ""PRT"": 3, ""VERB"": 10, ""ADV"": 3, ""PRON"": 8, ""DET"": 2, ""ADP"": 3, ""."": 2, ""CONJ"": 3, ""ADJ"": 1}"
"1123","Eleven","18","Travelling with a twelve-year-old, and two other grownup kids, this responsibility had to fall on me.","18","1","9","{""VERB"": 3, ""ADP"": 2, ""DET"": 2, ""ADJ"": 2, ""."": 2, ""CONJ"": 1, ""NUM"": 1, ""NOUN"": 3, ""PRT"": 1, ""PRON"": 1}"
"1124","Eleven","19","'It is ok, chacha. See now you can go to your election rally in Baroda,' I said.","20","2","7","{""NOUN"": 5, ""VERB"": 4, ""ADJ"": 2, ""."": 3, ""ADV"": 1, ""PRON"": 3, ""PRT"": 1, ""ADP"": 1}"
"1125","Eleven","20","'That's right. I cannot leave Ali with his ammi for four days.' 'Are you getting a ticket  this  year,'  I  said  as  I  chained  our  suitcase  to  the  lower  berth.  The  train began to move.","40","4","13","{""DET"": 5, ""VERB"": 8, ""ADJ"": 2, ""PRON"": 6, ""ADV"": 1, ""NOUN"": 9, ""ADP"": 3, ""NUM"": 1, ""PRT"": 3, ""."": 2}"
"1126","Eleven","21","'No, no. I am not that senior in the party. But I will be helping l he Belrampur candidate. Ali beta,' don't jump between berths, Ali...,' his voice trailed off as the train picked speed.","43","4","15","{""NUM"": 1, ""."": 7, ""DET"": 3, ""PRON"": 4, ""VERB"": 8, ""ADV"": 2, ""ADP"": 5, ""ADJ"": 1, ""NOUN"": 10, ""CONJ"": 1, ""PRT"": 1}"
"1127","Eleven","22","Ish pulled Ali's arm and drew him into his lap. 'Say bye properly,' Ish said.","18","2","4","{""NOUN"": 5, ""VERB"": 3, ""PRT"": 2, ""CONJ"": 1, ""PRON"": 2, ""ADP"": 1, ""ADJ"": 1, ""ADV"": 1, ""."": 2}"
"1128","Eleven","23","'Khuda Hafiz, abba,' Ali called out as the train left for sunnier climes.","16","1","4","{""NUM"": 1, ""NOUN"": 4, ""."": 3, ""ADV"": 1, ""VERB"": 2, ""PRT"": 1, ""ADP"": 2, ""DET"": 1, ""ADJ"": 1}"
"1129","Eleven","24","'Organisers. We have to meet the organisers. Let us go in,' I said. A hairy arm stopped me. The arm belonged to a security guard outside the VIP stand.","31","5","8","{""NOUN"": 10, ""PRON"": 4, ""VERB"": 7, ""PRT"": 2, ""DET"": 4, ""ADP"": 2, ""."": 2}"
"1130","Eleven","25","'Thirty  thousand  people  here  want  to  go  in  there.  Who  are  you?  Autograph hunters?' 'Say it,' Ish said to me in a hushed voice.","27","4","11","{""NUM"": 2, ""NOUN"": 6, ""ADV"": 1, ""VERB"": 4, ""PRT"": 3, ""ADP"": 2, ""DET"": 2, ""PRON"": 4, ""."": 2, ""ADJ"": 1}"
"1131","Eleven","26","'Get your senior. I want to talk to him.' 'Why?' the hairy guard said.","16","4","5","{""VERB"": 4, ""PRON"": 3, ""ADJ"": 2, ""PRT"": 2, ""."": 3, ""DET"": 1, ""NOUN"": 1}"
"1132","Eleven","27","I  flashed  out  a  card.  It  said  'Zuben  Singh,  Chairman,  Wilson  Sport,'  Pandit-ji had  once  met  the  chairman  of  the  biggest  sports  company  in  India.  I  had borrowed the card from his trunk.","37","3","12","{""PRON"": 4, ""VERB"": 6, ""PRT"": 1, ""DET"": 4, ""NOUN"": 13, ""."": 4, ""ADV"": 1, ""ADP"": 3, ""ADJ"": 1}"
"1133","Eleven","28","I own Wilson Sports. We want to talk about some endorsement deals. Now will you cooperate or...' The  security  guard  broke  into  a  sweat and  called  his  manager,  I  repeated  the story  to  him.  He  called  the  senior-most  security  person  who  came  in  a  suit.  I made  a  fake  phone  call  pretending  to  talk  about  ten-crore-rupees  business orders.  He  remained  sceptical,  I  ended  another  call  in  Gujarati  and  his  face softened.","75","6","24","{""PRON"": 12, ""VERB"": 15, ""ADJ"": 5, ""NOUN"": 19, ""PRT"": 3, ""ADP"": 5, ""DET"": 8, ""ADV"": 1, ""CONJ"": 3, ""."": 4}"
"1134","Eleven","29","'Gujarati?' he said.","4","2","1","{""NOUN"": 1, ""PRT"": 1, ""PRON"": 1, ""VERB"": 1}"
"1135","Eleven","30","I stared  at him,  trying to decipher the  better answer. In India you don't know whether someone will like you or hate you because you are from a certain place.","32","2","15","{""PRON"": 6, ""VERB"": 9, ""ADP"": 5, ""."": 1, ""PRT"": 1, ""DET"": 2, ""ADJ"": 2, ""NOUN"": 4, ""ADV"": 1, ""CONJ"": 1}"
"1136","Eleven","31","'Yes,' I said guardedly.","6","1","0","{""NUM"": 1, ""."": 2, ""PRON"": 1, ""VERB"": 1, ""ADV"": 1}"
"1137","Eleven","32","'Oh, how are you?' he said in Gujarati. Thank God for India's various regional clubs.","18","3","6","{""NOUN"": 6, ""."": 2, ""ADV"": 1, ""VERB"": 2, ""PRON"": 2, ""ADP"": 2, ""PRT"": 1, ""ADJ"": 2}"
"1138","Eleven","33","I just landed from Ahmedabad,' I said.","9","1","2","{""PRON"": 2, ""ADV"": 1, ""VERB"": 2, ""ADP"": 1, ""NOUN"": 1, ""."": 2}"
"1139","Eleven","34","'Why have you come without an appointment?' he said.","10","2","4","{""NOUN"": 2, ""VERB"": 3, ""PRON"": 2, ""ADP"": 1, ""DET"": 1, ""PRT"": 1}"
"1140","Eleven","35","'I  came  to  see  the  match.  I  saw  the  Australians  play  and  thought  maybe  we could find a brand ambassador.' 'Why Australian? Why don't you take an Indian?' A  totally  irrelevant  question,  but  it  hinted  at  his  growing  belief  is  us.  'Can't afford  the  Indian  team.  The  good  players  are  too  expensive.  The  bad  ones,  well, tell me, will you buy a bat endorsed by Ajit Agarkar?' The  guard  nodded.  He  spoke  into  a  microphone  hanging  from  his  ear  and turned to us.","93","10","28","{""PRT"": 6, ""PRON"": 12, ""VERB"": 22, ""DET"": 10, ""NOUN"": 17, ""CONJ"": 3, ""ADV"": 7, ""."": 5, ""ADJ"": 7, ""ADP"": 4}"
"1141","Eleven","36","'One of you stay with us,' the security head said.","12","1","4","{""NUM"": 1, ""ADP"": 2, ""PRON"": 2, ""VERB"": 2, ""."": 2, ""DET"": 1, ""NOUN"": 2}"
"1142","Eleven","37","'He will,' I said and pointed to Omi.","10","1","3","{""NUM"": 1, ""VERB"": 4, ""."": 2, ""PRON"": 1, ""CONJ"": 1, ""PRT"": 1}"
