"serial_no","chapter_name","paragraph_number","paragraph","Word_Count","Sentance_Count","Stop_Words","Post_INFO"
"1678","Fifteen","138","'The  by-elections  for  these  seats  came  as  a  boon.  The  old  school  put  their candidate.  We  knew  they  were  weak.  Of  count,  hardworking  people  like  Bittoo tried  their  best  But,  a  dud  candidate  is  a  dud  candidate.  So  we  lost  both  the seats.  With  the  main election in  twelve  months,  the  entire  party  machinery  is shaken up. And the high command finally gets a chance to make a change.' 'What change?' Mama said.","78","9","23","{""PRT"": 3, ""NOUN"": 20, ""ADP"": 7, ""DET"": 12, ""VERB"": 13, ""ADJ"": 9, ""PRON"": 6, ""."": 4, ""CONJ"": 2, ""ADV"": 2}"
"1679","Fifteen","139","""They are replacing the chief minister.' 'What? For losing two seats?' Mama said, 'the total number of seats is...' 'A hundred and eighty plus,' Parekh-ji said as he broke his bajra rati, 'but like I said, it gave a reason to change. And Gujarat is vital to our party. We can't afford to lose it.' 'No  dessert  here  or  what?'  Parekh-ji  said  as  there  was  a  delay  after  the  main courses were cleared.","87","8","26","{""."": 14, ""PRON"": 10, ""VERB"": 18, ""DET"": 6, ""ADJ"": 5, ""NOUN"": 15, ""PRT"": 5, ""ADP"": 6, ""NUM"": 2, ""CONJ"": 4, ""ADV"": 2}"
"1680","Fifteen","140","'Who will get the aamras for the sahib?' Mama screamed at the waiters.","14","2","6","{""NOUN"": 5, ""VERB"": 3, ""DET"": 3, ""ADP"": 2, ""PRT"": 1}"
"1681","Sixteen","1","Where's  your  smallest  chocolate  cake?'  I  was  at  Navrangpura's  Ten,  the  best cake  shop  in  Ahmedabad.  Vidya  turned  eighteen  on  19  November  2001.  She could now officially make her own decisions. Unofficially, she had done that since birth.","43","5","12","{""ADV"": 4, ""VERB"": 7, ""PRON"": 5, ""ADJ"": 4, ""NOUN"": 11, ""."": 3, ""ADP"": 5, ""PRT"": 1, ""DET"": 1, ""NUM"": 2}"
"1682","Sixteen","2","'No bag  please,'  I  said as I kept the cake  box  in my rucksack  of books. I  kept the rucksack upright in my lap until I made it to Vidya's place.","34","2","11","{""PRT"": 3, ""NOUN"": 11, ""."": 2, ""PRON"": 7, ""VERB"": 4, ""ADP"": 5, ""DET"": 2}"
"1683","Sixteen","3","Entering Vidya's house while hiding a cake was hard enough. Ish being in the house  made  it  worse.  India  was  playing  England  It  Kolkata  Eden  Gardens  in  a day-night  match.  Ish  had  plonked  himself  in  front  of  the  sofa  with  sandwiches, milk, chips and biscuits - everything that he needed to survive for the next eight hours. Ish's dad sat on the dining table, continuing his PhD on the newspapers of India.  As  was  often  the  case  when  Ish  was  around,  uncle  had  a  disgusted expression on his face.","95","6","36","{""VERB"": 18, ""NOUN"": 32, ""PRT"": 3, ""ADP"": 12, ""DET"": 9, ""ADJ"": 4, ""ADV"": 4, ""PRON"": 6, ""."": 5, ""CONJ"": 1, ""NUM"": 1}"
"1684","Sixteen","4","I snuck the rucksack between my arm and side body to keep it horizontal.","14","1","6","{""PRON"": 3, ""VERB"": 2, ""DET"": 1, ""NOUN"": 4, ""ADP"": 1, ""CONJ"": 1, ""PRT"": 1, ""ADJ"": 1}"
"1685","Sixteen","5","'India's  batting - Ganguly and  Tendulkar. Seventy  no loss after ten  overs,' Ish said and screamed, 'Mom, sauce!' Uncle picked up the ketchup bottle from the dining table and banged it as hard as possible on the coffee table in front of his son.","50","3","17","{""NOUN"": 17, ""PRT"": 2, ""."": 7, ""CONJ"": 3, ""DET"": 4, ""ADP"": 6, ""ADJ"": 2, ""VERB"": 5, ""PRON"": 2, ""ADV"": 2}"
"1686","Sixteen","6","'Thanks dad,' Ish said. 'Can you move. Can't see the TV.' Ish's dad gave his son a dirty look and moved.","26","4","5","{""NOUN"": 8, ""VERB"": 7, ""."": 2, ""PRON"": 2, ""ADV"": 1, ""DET"": 2, ""PRT"": 2, ""ADJ"": 1, ""CONJ"": 1}"
"1687","Sixteen","7","'Sit no,' Ish said to me.","8","1","3","{""NUM"": 1, ""DET"": 1, ""."": 2, ""NOUN"": 1, ""VERB"": 1, ""PRT"": 1, ""PRON"": 1}"
"1688","Sixteen","8","'Tuitions,' I said, pointing to Vidya's room.","11","1","1","{""NOUN"": 3, ""."": 3, ""PRON"": 1, ""VERB"": 2, ""PRT"": 2}"
"1689","Sixteen","9","'Oh, you've come for that. She's studying on her birthday, dedication dude.' 'Some  people  are  serious  about  their  lives...,' Ish's  dad  ranted  while  still reading his paper.","36","3","10","{""NUM"": 1, ""."": 6, ""PRON"": 5, ""VERB"": 7, ""ADP"": 4, ""DET"": 1, ""NOUN"": 8, ""ADJ"": 2, ""PRT"": 1, ""ADV"": 1}"
"1690","Sixteen","10","Ish pressed the volume button on the TV remote as loud as possible in protest.","15","1","6","{""NOUN"": 6, ""VERB"": 1, ""DET"": 2, ""ADP"": 3, ""ADV"": 1, ""ADJ"": 2}"
"1691","Sixteen","11","'His  mother  has  made  him  into  a  monster,'  Ish's  dad  said  and  left  for  his bedroom. Tendulkar struck a four and the monster clapped.","27","2","10","{""PRT"": 2, ""NOUN"": 7, ""VERB"": 6, ""PRON"": 2, ""ADP"": 2, ""DET"": 3, ""."": 2, ""CONJ"": 2, ""NUM"": 1}"
"1692","Sixteen","12","'Don't worry, dad's fine,' Ish said as he saw my nervous expression. 'Hey, wish her and all. She'll like it. I forgot this morning.' Ish grabbed a sandwich and topped it with lots of chips and ketchup. He took a big bite. My friend had found bliss. I had to find mine.","60","8","18","{""VERB"": 14, ""ADV"": 1, ""."": 5, ""NOUN"": 12, ""PRT"": 3, ""ADJ"": 3, ""ADP"": 5, ""PRON"": 10, ""CONJ"": 3, ""DET"": 4}"
"1693","Sixteen","13","I  climbed  the  stairs,  my  heart  beating  fast.  'Happy  birthday,  Miss  Eighteen,'  I greeted as I shut the terrace door.","24","2","4","{""PRON"": 4, ""VERB"": 4, ""DET"": 2, ""NOUN"": 7, ""."": 4, ""ADV"": 1, ""ADJ"": 1, ""ADP"": 1}"
"1694","Sixteen","14","She  wore  a  shiny  red  kurti  and  white  pants.  The  choice  of  clothes  was  a  bit over the top but it was ok on a birthday I guess.","28","2","12","{""PRON"": 3, ""VERB"": 5, ""DET"": 5, ""ADJ"": 4, ""NOUN"": 6, ""CONJ"": 2, ""ADP"": 3}"
"1695","Sixteen","15","'Did you know eighteen is the only number that is twice the sum of its digits?' she said.","19","2","10","{""ADP"": 2, ""PRON"": 3, ""VERB"": 4, ""DET"": 4, ""ADJ"": 1, ""NOUN"": 3, ""ADV"": 1, ""PRT"": 1}"
"1696","Sixteen","16","I took out the cake and placed it on the white plastic table.","13","1","6","{""PRON"": 2, ""VERB"": 2, ""PRT"": 1, ""DET"": 2, ""NOUN"": 3, ""CONJ"": 1, ""ADP"": 1, ""ADJ"": 1}"
"1697","Sixteen","17","'A cake from Ten! Someone is going high-class,' she teased.","13","2","3","{""."": 3, ""DET"": 1, ""NOUN"": 4, ""ADP"": 1, ""VERB"": 3, ""PRON"": 1}"
"1698","Sixteen","18","'You  like  chocolate. They  have  the  best.' I  opened  the  box. She  stood  up  from her chair and came next to me to see the cake.","27","4","11","{""NOUN"": 5, ""ADP"": 2, ""PRON"": 5, ""VERB"": 5, ""DET"": 3, ""ADJ"": 2, ""PRT"": 3, ""ADV"": 1, ""CONJ"": 1}"
"1699","Sixteen","19","'You've changed since we have had this thing.' 'What thing?' I peeped into her big eyes.","19","3","6","{""PRT"": 1, ""VERB"": 5, ""ADP"": 2, ""PRON"": 3, ""DET"": 1, ""NOUN"": 3, ""."": 2, ""NUM"": 1, ""ADJ"": 1}"
"1700","Sixteen","20","'This  thing,'  she  said  and  came  forward  to  kiss  me.  We  kissed  during  almost every  class  since  the  last  month,  so  it  wasn't  a  big  deal.  Sometimes  we  kissed everytime  she  solved  a  problem.  At  other  times,  we  took  a  kissing  break  every fifteen  minutes. Once,  we  didn't kiss at  all as she did a mock test.  However,  we made up for it in the next class where we spent the first ten minutes kissing and the  rest  discussing  her  mistakes.  When  we  felt  desire,  we  kissed.  When  we  felt guilty, we studied. Somehow, we balanced mathematics and romance within the hour quite well.","115","9","43","{""ADJ"": 8, ""NOUN"": 21, ""."": 9, ""PRON"": 18, ""VERB"": 21, ""CONJ"": 3, ""ADV"": 12, ""PRT"": 2, ""ADP"": 9, ""DET"": 12}"
"1701","Sixteen","21","We went to the edge of the terrace. The last bit of sunlight disappeared as the sky turned dark orange. The evening breeze held a chill. At a distance, we saw the dome of Omi's temple.","38","4","12","{""PRON"": 2, ""VERB"": 5, ""PRT"": 2, ""DET"": 8, ""NOUN"": 12, ""ADP"": 6, ""ADJ"": 2, ""."": 1}"
"1702","Sixteen","22","She entwined her hands with mine and looked at me. 'You tell me,' she said as she removed a strand of hair from her face, 'should I become a doctor?' I shook my head.","38","3","15","{""PRON"": 10, ""VERB"": 7, ""NOUN"": 7, ""ADP"": 5, ""CONJ"": 1, ""NUM"": 1, ""."": 4, ""DET"": 2, ""PRT"": 1}"
"1703","Sixteen","23","'Then how do I get out?' 'Apply to whichever college and just go,' I said.","18","2","6","{""PRT"": 3, ""ADV"": 2, ""VERB"": 5, ""PRON"": 2, ""."": 4, ""NOUN"": 1, ""CONJ"": 1}"
"1704","Sixteen","24","'How?' she said as she tugged my hand. 'How will I even get the application fee to apply? How will I support myself in Mumbai?' 'Your parents will eventually come around. They will pay for your studies. Until then...' A loud roar went through the pol and startled us. India had hit a six.","58","8","20","{""NOUN"": 11, ""."": 3, ""PRON"": 9, ""VERB"": 15, ""ADP"": 6, ""PRT"": 3, ""ADV"": 3, ""DET"": 4, ""NUM"": 2, ""ADJ"": 1, ""CONJ"": 1}"
"1705","Sixteen","25","'Until then what?' she said after the noise subsided.","10","2","5","{""PRT"": 1, ""ADV"": 1, ""PRON"": 2, ""."": 1, ""VERB"": 2, ""ADP"": 1, ""DET"": 1, ""NOUN"": 1}"
"1706","Sixteen","26","'Until  then  I  will support  you,'  I  said.  We  looked  into  each  other's  eyes.  She smiled. We took a walk around the perimeter of the terrace.","29","4","10","{""ADP"": 4, ""ADV"": 1, ""PRON"": 6, ""VERB"": 6, ""."": 2, ""DET"": 4, ""ADJ"": 1, ""PRT"": 1, ""NOUN"": 4}"
"1707","Sixteen","27","'So my tutor doesn't believe I need to figure out maths problems?' 'Figuring out the maths of life is more important,' I said. 'What's that?' 'Who you are, what do you want versus what people expect of you. And how to keep what you want without pissing off people too much. Life is an optimisation problem, with tons of variables and constraints.' 'Is it possible to run away and not piss off my parents?' 'You  can  minimise  the  pissed-off  state,  but  can't  make  it  zero.  We  can  only optimise life, never solve it,' I said as we came to a corner.","116","9","46","{""PRT"": 11, ""PRON"": 18, ""NOUN"": 20, ""VERB"": 27, ""ADV"": 9, ""ADP"": 10, ""DET"": 5, ""ADJ"": 3, ""."": 9, ""CONJ"": 4}"
"1708","Sixteen","28","'Can I tell you something weird?' 'What?' 'When you talk hardcore maths, like these terms that totally go over my head,' she said, her hand in take-off motion above her head.","37","3","11","{""VERB"": 5, ""PRON"": 8, ""NOUN"": 7, ""ADJ"": 3, ""PRT"": 2, ""."": 5, ""ADP"": 4, ""DET"": 2, ""ADV"": 1}"
"1709","Sixteen","29","'Yes.' 'It turns me on.' 'Vidya,  your  boldness...,'  I  said,  shocked.  'Makes  you  blush,  right?'  she  said and laughed. 'So we are cutting this cake or what?' I said to change the topic.","43","7","13","{""PRT"": 4, ""."": 9, ""NOUN"": 4, ""PRON"": 8, ""ADP"": 3, ""NUM"": 1, ""VERB"": 9, ""ADJ"": 1, ""CONJ"": 2, ""DET"": 2}"
"1710","Sixteen","30","'Of course, follow me to Café Vidya,' she said.","12","1","3","{""ADJ"": 1, ""NOUN"": 3, ""."": 3, ""VERB"": 2, ""PRON"": 2, ""PRT"": 1}"
"1711","Sixteen","31","We  slid  under  the  water  tank  and  sat  on  the  floor.  She  had  brought  six  pink cushions and a rug. 'I brought them from my room, so we can have a little party here,' she said and passed a couple to me. Under the cushions, she had a stereo.","54","4","26","{""PRON"": 9, ""VERB"": 9, ""ADP"": 5, ""DET"": 7, ""NOUN"": 11, ""CONJ"": 3, ""NUM"": 1, ""ADJ"": 2, ""PRT"": 2, ""."": 4, ""ADV"": 1}"
"1712","Sixteen","32","'Music?' she said, her face pretty as a song. I nodded.","13","3","4","{""ADJ"": 1, ""."": 2, ""PRON"": 3, ""VERB"": 2, ""NOUN"": 2, ""ADV"": 1, ""ADP"": 1, ""DET"": 1}"
"1713","Sixteen","33","'I'll  put  on  Boyzone,  my  favourite,'  she  said.  I  took  out  the  packet  of  eighteen candles that came with the cake.","26","2","9","{""PRT"": 2, ""PRON"": 4, ""VERB"": 5, ""ADP"": 3, ""NOUN"": 4, ""."": 3, ""ADJ"": 2, ""DET"": 3}"
"1714","Sixteen","34","'Let's light all of them,' she said.","10","1","4","{""NOUN"": 1, ""PRT"": 1, ""ADJ"": 1, ""DET"": 1, ""ADP"": 1, ""PRON"": 2, ""."": 2, ""VERB"": 1}"
"1715","Sixteen","35","I wanted to go switch on the terrace light as it had become dark.","14","1","6","{""PRON"": 2, ""VERB"": 5, ""PRT"": 1, ""ADP"": 2, ""DET"": 1, ""NOUN"": 2, ""ADJ"": 1}"
"1716","Sixteen","36","'Let it be,' she said and pulled my hand as she lit the eighteenth candle.","17","1","8","{""VERB"": 5, ""PRON"": 4, ""."": 2, ""CONJ"": 1, ""NOUN"": 2, ""ADP"": 1, ""DET"": 1, ""ADJ"": 1}"
"1717","Sixteen","37","'What if someone comes?' 'Both my parents have bad knees. They never climb up to the terrace. And Ish, well there is a match on.' We heard two consecutive roars in the pol. The Indian innings had reached the slog overs.","44","6","14","{""ADP"": 4, ""NOUN"": 11, ""VERB"": 7, ""PRT"": 4, ""PRON"": 3, ""ADJ"": 3, ""ADV"": 2, ""DET"": 6, ""CONJ"": 1, ""."": 2, ""NUM"": 1}"
"1718","Sixteen","38","She  released  my  hand  as  I  sat  down  again.  She  looked  beautiful  as  the candlelight  flickered  on  her  face.  A  song  called  'No  matter  what'  started  to  play.","29","3","10","{""PRON"": 6, ""VERB"": 8, ""NOUN"": 4, ""ADP"": 3, ""ADV"": 2, ""ADJ"": 1, ""DET"": 2, ""NUM"": 1, ""."": 1, ""PRT"": 1}"
"1719","Sixteen","39","Like with all romantic songs, the lyrics seemed tailor-made for us.","12","1","4","{""ADP"": 3, ""DET"": 2, ""ADJ"": 1, ""NOUN"": 3, ""."": 1, ""VERB"": 1, ""PRON"": 1}"
"1720","Sixteen","40","No matter what they tell us No matter what they do No matter what they teach us What we believe is true The  candle  flames  appeared  to  move  to  the  rhythm  of  the  music.  She  cut  the cake  with  the  plastic knife  that  came  in  the  box.  I  wished  her  again  and  put  a piece of cake in her mouth. She held it in her mouth and leaned towards me. She pushed  me  back  on  the  cushions  and  brought  her  mouth  close  to  mine  for  my share of the cake.","90","5","42","{""DET"": 13, ""NOUN"": 20, ""PRON"": 22, ""VERB"": 15, ""ADJ"": 3, ""PRT"": 4, ""ADP"": 9, ""ADV"": 1, ""CONJ"": 3}"
"1721","Sixteen","41","She  kissed  me  like  she  never  had  before.  It  wasn't  like  she  did  anything different,  but  there  seemed  to  be  more  feeling  behind  it.  Her  hands  came  to  my shoulders and under my shirt.","36","3","18","{""PRON"": 9, ""VERB"": 7, ""ADP"": 5, ""ADV"": 4, ""NOUN"": 4, ""ADJ"": 2, ""."": 1, ""CONJ"": 2, ""PRT"": 2}"
"1722","Sixteen","42","The music continued.","3","1","0","{""DET"": 1, ""NOUN"": 1, ""VERB"": 1}"
"1723","Sixteen","43","I can't deny what I believe I can't be what I'm not I know this love's forever That's all that matters now I don't know if it was the candlelight or the birthday mood or the cushions or what. But it was then that I made the second mistake of my life.","58","2","26","{""PRON"": 13, ""VERB"": 13, ""ADV"": 6, ""DET"": 7, ""NOUN"": 8, ""PRT"": 1, ""ADP"": 4, ""CONJ"": 4, ""ADJ"": 2}"
"1724","Sixteen","44","I opened the top button of her kurti and slid my fingers inside. A voice inside stopped me, I took my hand out. But she continued to kiss me as she unbuttoned the rest of her top. She pulled my fingers towards her again.","45","4","19","{""PRON"": 13, ""VERB"": 9, ""DET"": 2, ""ADJ"": 2, ""NOUN"": 9, ""ADP"": 4, ""CONJ"": 2, ""."": 1, ""PRT"": 2, ""ADV"": 1}"
"1725","Sixteen","45","'Vidya...'  By  this time  my  hand was in places impossible to withdraw from for any guy. So, I went with the flow, feelings, desire, nature or whatever else people called the stuff that evaporated human rationality.","42","2","13","{""."": 6, ""PRT"": 2, ""ADP"": 5, ""DET"": 6, ""NOUN"": 12, ""PRON"": 2, ""VERB"": 5, ""ADJ"": 2, ""CONJ"": 1, ""ADV"": 1}"
"1726","Sixteen","46","She took off her kurti. 'Remove your hand, they won't run away.' 'Huh?' I said.","19","4","4","{""PRON"": 5, ""VERB"": 4, ""PRT"": 3, ""NOUN"": 3, ""ADP"": 1, ""."": 1, ""ADV"": 2}"
"1727","Sixteen","47","'How else do I remove this?' she said, pointing to her bra. I moved my hands to her stomach as she took the bra off and lay on top of me.","33","3","16","{""PRT"": 3, ""ADV"": 1, ""VERB"": 7, ""PRON"": 8, ""DET"": 2, ""."": 2, ""NOUN"": 5, ""ADP"": 4, ""CONJ"": 1}"
"1728","Sixteen","48","'Take it off,' she said, tugging at my shirt. At this point, I could have jumped off the terrace if she asked me to. I followed her instruction instantly.","33","3","14","{""VERB"": 8, ""PRON"": 8, ""PRT"": 3, ""."": 4, ""ADP"": 3, ""NOUN"": 4, ""DET"": 2, ""ADV"": 1}"
"1729","Sixteen","49","The music didn't stop, and neither did we. We went further and further as the tiny  cake  candles  burned  out  one  by  one.  Sweat  beads  glistened  on  our  bodies.","31","3","13","{""DET"": 2, ""NOUN"": 6, ""VERB"": 6, ""ADV"": 4, ""."": 1, ""CONJ"": 2, ""PRON"": 3, ""ADP"": 3, ""ADJ"": 1, ""PRT"": 1, ""NUM"": 2}"
"1730","Sixteen","50","Vidya didn't say anything throughout, apart from one time in the middle.","14","1","4","{""NOUN"": 4, ""VERB"": 2, ""ADV"": 2, ""ADP"": 3, ""."": 1, ""NUM"": 1, ""DET"": 1}"
"1731","Sixteen","51","'Are you going to go down on me?' she said, after she had done the same to me.","20","2","13","{""PRT"": 4, ""PRON"": 5, ""VERB"": 5, ""ADP"": 2, ""."": 2, ""DET"": 1, ""ADJ"": 1}"
"1732","Sixteen","52","I  went  down,  and  came  back  up.  We  looked  into  each  other's  eyes  as  we became one. The screams from the pols continued as England lost wickets.","29","3","11","{""PRON"": 3, ""VERB"": 6, ""ADV"": 2, ""."": 1, ""CONJ"": 1, ""ADP"": 5, ""DET"": 3, ""ADJ"": 1, ""PRT"": 1, ""NOUN"": 5, ""NUM"": 1}"
"1733","Sixteen","53","Only four candles remained burning by the time we finished. We combined the six cushions to make one mattress and lay on it. Only after we were done did we realise  how  cold  and  chilly  it  really  was.  We  covered  ourselves  in  my  jacket  and dug our cold feet inside the lower cushions.","53","4","23","{""ADV"": 4, ""NUM"": 3, ""NOUN"": 8, ""VERB"": 13, ""ADP"": 5, ""DET"": 3, ""PRON"": 10, ""PRT"": 1, ""CONJ"": 3, ""ADJ"": 3}"
"1734","Sixteen","54","'Wow, I am an adult and am no longer a virgin, so cool. Thank God,' she said and  giggled.  She  cuddled  next  to  me.  A  sense  of  reality  struck  as  the  passion subsided. What have you done Mr Govind Patel?","44","5","16","{""NUM"": 1, ""."": 4, ""PRON"": 6, ""VERB"": 9, ""DET"": 3, ""NOUN"": 11, ""CONJ"": 2, ""ADV"": 3, ""ADJ"": 2, ""PRT"": 1, ""ADP"": 2}"
"1735","Sixteen","55","'See,  I  still  have  goosebumps,'  she  said  and  lifted  her  arm.  Little  pink  bumps dotted her flawless, fair skin.","23","2","5","{""NUM"": 1, ""."": 4, ""PRON"": 4, ""ADV"": 1, ""VERB"": 4, ""NOUN"": 7, ""CONJ"": 1, ""ADJ"": 1}"
"1736","Sixteen","56","Fuck,  fuck,  fuck,  Govind,  what  are  you  doing  right  now?  Touching  her goosebumps? The voice in me grew stronger.","23","3","8","{""NOUN"": 5, ""."": 4, ""PRON"": 4, ""VERB"": 5, ""ADV"": 2, ""DET"": 1, ""ADP"": 1, ""ADJ"": 1}"
"1737","Sixteen","57","I am so glad this happened. Aren't you?' she said.","12","3","5","{""PRON"": 3, ""VERB"": 4, ""ADV"": 2, ""ADJ"": 1, ""DET"": 1, ""."": 1}"
"1738","Sixteen","58","I kept quiet.","3","1","0","{""PRON"": 1, ""VERB"": 1, ""ADJ"": 1}"
"1739","Sixteen","59","'Say something.' 'I should get going.' 'Don't you like it here?' 'Here? You realise we are on top of your dad and mom and brother?' 'Stop freaking out,' she said.","38","6","13","{""NUM"": 2, ""NOUN"": 5, ""."": 6, ""PRT"": 1, ""PRON"": 7, ""VERB"": 8, ""ADV"": 4, ""ADP"": 3, ""CONJ"": 2}"
"1740","Sixteen","60","'I am sorry. I am nervous,' I said.","11","2","2","{""PRT"": 1, ""PRON"": 3, ""VERB"": 3, ""ADJ"": 2, ""."": 2}"
"1741","Sixteen","61","'Don't be,' she said and hugged me. She felt my body shake. 'You ok?' I  didn't  know  why,  but  I  had  tears  in  my  eyes.  Maybe  I  felt  scared.  Maybe because no one had held me like that ever and asked if I was ok. Maybe because I never  knew  it  would  be  possible  for  me  to  feel  like  this.  Maybe  because  I  had betrayed my best friend. I normally never cried, but with so many reasons at the same time, it was impossible not to.","94","8","39","{""VERB"": 22, ""ADV"": 12, ""."": 5, ""PRON"": 17, ""CONJ"": 4, ""NOUN"": 9, ""ADJ"": 7, ""ADP"": 11, ""PRT"": 3, ""DET"": 4}"
"1742","Sixteen","62","'Hey, I'm the girl. Let me do this part,' she said. I looked into her moist eyes.","21","3","7","{""NUM"": 1, ""."": 3, ""PRON"": 5, ""VERB"": 5, ""DET"": 2, ""NOUN"": 3, ""ADP"": 1, ""ADJ"": 1}"
"1743","Sixteen","63","I  sat  up  and  dressed.  We  came  outside  as  the  moon  lit  up  the  terrace.  I checked my watch. I had overshot the class time by thirty minutes.","28","4","10","{""PRON"": 5, ""VERB"": 7, ""ADV"": 2, ""CONJ"": 1, ""ADP"": 2, ""DET"": 3, ""NOUN"": 7, ""PRT"": 1}"
"1744","Sixteen","64","'I love you,' she said from behind as I opened the terrace door.","16","1","5","{""PRT"": 1, ""PRON"": 4, ""VERB"": 3, ""."": 2, ""ADP"": 3, ""DET"": 1, ""NOUN"": 2}"
"1745","Sixteen","65","'Happy birthday,' I said and left.","8","1","1","{""ADJ"": 1, ""NOUN"": 1, ""."": 2, ""PRON"": 1, ""VERB"": 2, ""CONJ"": 1}"
"1746","Sixteen","66","'Hey, you missed the best part. We will win this. Stay on,' Ish said as I reached downstairs.","21","3","6","{""NUM"": 1, ""."": 3, ""PRON"": 3, ""VERB"": 5, ""DET"": 2, ""ADJ"": 1, ""NOUN"": 4, ""ADP"": 2}"
"1747","Sixteen","67","'No, I'm quite tired. I'll watch it at home,' I said as I reached the main door.","22","2","4","{""NUM"": 1, ""."": 3, ""PRON"": 5, ""VERB"": 6, ""ADV"": 1, ""ADP"": 2, ""NOUN"": 2, ""DET"": 1, ""ADJ"": 1}"
"1748","Sixteen","68","'Eat  dinner,  son,'  Ish's  mother  said  as  she  set  the  table.  'I've  made  special dishes for Vidya's birthday.","25","2","4","{""NUM"": 1, ""NOUN"": 8, ""."": 3, ""PRT"": 3, ""VERB"": 4, ""ADP"": 2, ""PRON"": 2, ""DET"": 1, ""ADJ"": 1}"
"1749","Sixteen","69","'No  aunty,  my  mummy  has  cooked  at  home  as  well,'  I  said.  I  had  already celebrated her daughter's birthday.","23","2","6","{""NUM"": 1, ""NOUN"": 5, ""."": 3, ""PRON"": 4, ""VERB"": 5, ""ADP"": 1, ""ADV"": 3, ""PRT"": 1}"
"1750","Sixteen","70","'Such a good boy,' she said fondly as I left the house.","14","1","4","{""DET"": 3, ""ADJ"": 1, ""NOUN"": 2, ""."": 2, ""PRON"": 2, ""VERB"": 2, ""ADV"": 1, ""ADP"": 1}"
"1751","Seventeen","1","Hold it tight, it is shaking,' Omi said. He stood on his toes on a stool to reach the  ceiling.  We  wanted  to  drop  the  tricolour  ribbons  from  the  ceiling  fan.  I  held the legs of the stool, Ish stood next to us with glue and cellotape.","51","4","19","{""VERB"": 10, ""PRON"": 7, ""ADJ"": 3, ""."": 4, ""NOUN"": 12, ""ADP"": 5, ""DET"": 6, ""PRT"": 3, ""CONJ"": 1}"
"1752","Seventeen","2","'I'll fall,' Omi warned, dangling his right foot off the stool.","16","1","3","{""PRT"": 1, ""PRON"": 2, ""VERB"": 4, ""."": 3, ""NOUN"": 3, ""ADJ"": 1, ""ADP"": 1, ""DET"": 1}"
"1753","Seventeen","3","'It's not my fault. The stool has creaky legs,' I said.","14","2","3","{""NOUN"": 4, ""PRT"": 1, ""ADV"": 1, ""PRON"": 2, ""DET"": 1, ""VERB"": 3, ""."": 2}"
"1754","Seventeen","4","I never wanted to celebrate Republic Day, which came in a week. However, we did  want  to  celebrate  our  resurrection  after  the earthquake  a  year  ago.  Though thoughts about that  day  still  made me tremble,  I was relieved  to have fully paid off our loans. Our business had tripled from a year ago and it all happened from this shop.","63","4","27","{""PRON"": 8, ""ADV"": 6, ""VERB"": 14, ""PRT"": 4, ""NOUN"": 12, ""."": 3, ""DET"": 8, ""ADP"": 6, ""ADJ"": 1, ""CONJ"": 1}"
"1755","Seventeen","5","'January  26  preparations?  Keep  it  up,'  Mama's  entry  distracted  us  all.  Omi toppled from the stool and landed on the floor. The ribbons fell on his head.","30","4","10","{""ADJ"": 1, ""NUM"": 1, ""NOUN"": 8, ""VERB"": 5, ""PRON"": 3, ""PRT"": 2, ""."": 2, ""DET"": 4, ""ADP"": 3, ""CONJ"": 1}"
"1756","Seventeen","6","'You let go!' he accused me as everyone laughed.","10","2","3","{""PRT"": 2, ""NOUN"": 2, ""VERB"": 3, ""PRON"": 2, ""ADP"": 1}"
"1757","Seventeen","7","Mama placed a brown bag of samosas and some yellow pamphlets on the table.","14","1","6","{""NOUN"": 5, ""VERB"": 1, ""DET"": 3, ""ADJ"": 2, ""ADP"": 2, ""CONJ"": 1}"
"1758","Seventeen","8","We grabbed a samosa each.","5","1","2","{""PRON"": 1, ""VERB"": 1, ""DET"": 2, ""NOUN"": 1}"
"1759","Seventeen","9","'What exactly  are  you  counting?'  I  asked  idly.  'The  number  of  times  we  have made love,' she replied. 'Wow, our score is eight already.' 'You keep track?' I said.","35","6","8","{""DET"": 1, ""ADV"": 3, ""VERB"": 9, ""PRON"": 7, ""."": 5, ""ADJ"": 2, ""NOUN"": 5, ""ADP"": 1, ""NUM"": 1, ""PRT"": 1}"
"1760","Seventeen","10","'I keep track of a lot of things.' 'Like what?' 'Like today is 21 Feb, only five days to my period. Hence, it is a safe day.' 'It's safe anyway. I used a condom,' I said as I shifted my cushion for comfort.","52","6","15","{""PRT"": 5, ""PRON"": 8, ""VERB"": 6, ""NOUN"": 14, ""ADP"": 5, ""DET"": 3, ""."": 5, ""ADJ"": 3, ""NUM"": 2, ""ADV"": 1}"
"1761","Seventeen","11","'Oh?  So  now  you  trust  physics  over  mathematics?'  she  said  and  giggled.  She flipped over to rest on her elbows and poked her toes into my shins.","28","4","13","{""NOUN"": 6, ""ADV"": 2, ""PRON"": 6, ""VERB"": 6, ""ADP"": 4, ""PRT"": 2, ""CONJ"": 2}"
"1762","Seventeen","12","'Are you still embarrassed to buy condoms?' 'I get them from an unknown chemist in Satellite. And I have enough now for a while.' 'Oh really,' she climbed over me. 'So no problem in using a couple more then?' With that, our score reached nine.","52","6","21","{""ADP"": 7, ""PRON"": 7, ""ADV"": 6, ""VERB"": 8, ""PRT"": 5, ""NOUN"": 8, ""DET"": 5, ""ADJ"": 1, ""CONJ"": 1, ""."": 3, ""NUM"": 1}"
