"serial_no","chapter_name","paragraph_number","paragraph","Word_Count","Sentance_Count","Stop_Words","Post_INFO"
"459","Five","92","'I  found  out  after  you  guys  left  yesterday.  Sometimes  I  feel  I  run  a  gossip centre, not a clinic' Dr Verma chuckled. 'Anyway, that's the issue then. A priest's son teaching a Muslim boy.' 'I don't want to teach him,' Omi said quickly.","54","5","13","{""PRT"": 6, ""PRON"": 6, ""VERB"": 12, ""ADP"": 1, ""NOUN"": 14, ""DET"": 5, ""."": 5, ""ADV"": 5}"
"460","Five","93","'Shut up, Omi. You see what we have here?' Ish spoke.","13","3","5","{""NUM"": 1, ""PRT"": 1, ""."": 2, ""NOUN"": 2, ""PRON"": 3, ""VERB"": 3, ""ADV"": 1}"
"461","Five","94","Omi stood up, gave Ish a disapproving glance and left the room.","13","1","4","{""ADV"": 1, ""VERB"": 3, ""PRT"": 1, ""."": 1, ""NOUN"": 4, ""DET"": 2, ""CONJ"": 1}"
"462","Five","95","'How about the state academy?' Dr Verma said. 'They'll ruin him,' Ish said.","17","3","3","{""ADV"": 1, ""ADP"": 1, ""DET"": 1, ""NOUN"": 5, ""PRT"": 2, ""VERB"": 4, ""PRON"": 1, ""."": 2}"
"463","Five","96","'I  agree.'  Dr  Multani  paused.  'He  is  too  young,  Muslim  and  poor. And  he  is untrained.  I'd  suggest  you  keep  this  boy  and  his  talent  under  wraps  for  now.","33","5","12","{""PRT"": 1, ""PRON"": 5, ""VERB"": 7, ""."": 3, ""NOUN"": 6, ""ADV"": 2, ""ADJ"": 3, ""CONJ"": 3, ""DET"": 1, ""ADP"": 2}"
"464","Five","97","When the time comes, we will see.' We left the clinic. I took out four marbles from my pocket and called Ali.","24","3","8","{""ADV"": 1, ""DET"": 2, ""NOUN"": 5, ""VERB"": 6, ""."": 1, ""PRON"": 4, ""PRT"": 2, ""NUM"": 1, ""ADP"": 1, ""CONJ"": 1}"
"465","Five","98","'Ali, time to go. Here, catch.' I  threw  the  four  marbles  high  in  the  air  towards  him.  I  had  thrown  them purposely apart.","26","4","7","{""NUM"": 2, ""."": 3, ""NOUN"": 4, ""PRT"": 1, ""VERB"": 5, ""ADV"": 3, ""PRON"": 4, ""DET"": 2, ""ADP"": 2}"
"466","Five","99","Ali looked away from his game and saw the marbles midair. He remained in his squat position and raised his left hand high. One, two, three, four - like a magic wand his left hand moved. He caught every single one of them.","46","4","12","{""NOUN"": 8, ""VERB"": 6, ""PRT"": 1, ""ADP"": 4, ""PRON"": 7, ""CONJ"": 2, ""DET"": 3, ""ADJ"": 6, ""NUM"": 5, ""."": 4}"
"467","Six","1","He  won't  agree,  I  spoke  to  him  already,'  Ali  huffed.  We  reached  the  end  of Belrampur to get to his house. He lived in a particularly squalid pol. Ali pressed the bell. I noticed his father's nameplate had a motif of the secular political party.","50","5","15","{""PRON"": 8, ""VERB"": 10, ""ADV"": 3, ""."": 3, ""PRT"": 4, ""NOUN"": 11, ""DET"": 5, ""ADP"": 3, ""ADJ"": 3}"
"468","Six","2","Ali, so late again,' his dad said as he opened the door. He wore an impeccable black achkan, which contrasted with his white beard and a tight skullcap of lace material. He looked around sixty, which meant Ali came late in his life.","48","3","16","{""NOUN"": 11, ""."": 5, ""ADV"": 4, ""PRON"": 6, ""VERB"": 7, ""ADP"": 5, ""DET"": 5, ""ADJ"": 4, ""CONJ"": 1}"
"469","Six","3","And who are you gentlemen?' he said.","8","2","4","{""CONJ"": 1, ""PRON"": 3, ""VERB"": 2, ""NOUN"": 1, ""PRT"": 1}"
"470","Six","4","'I am Ishaan,' Ish said. And this is Govind and Omi. We are Ali's friends.' 'Friends?' Ali's dad said, underlining the absurd age difference.","32","5","6","{""PRT"": 5, ""PRON"": 2, ""VERB"": 6, ""NOUN"": 11, ""."": 3, ""CONJ"": 2, ""DET"": 2, ""ADJ"": 1}"
"471","Six","5","'Yes abba, they came to play cricket at the school.  They have a sports shop. I told you, remember?' 'Come in,' Ali's dad said.","30","4","8","{""NUM"": 1, ""NOUN"": 7, ""."": 4, ""PRON"": 5, ""VERB"": 6, ""PRT"": 3, ""ADP"": 2, ""DET"": 2}"
"472","Six","6","We sat in the living room. Ali's mother, wearing a brown-Coloured salwar suit, brought in glasses of roohafza. Even though a dupatta covered most of her face, I could  make  out  that  she  must've  been  at least  twenty  years  younger  than  her husband. She scolded Ali for not studying for his test the next day. I think Indian mothers have two tasks - to tell children to eat more or study more.","77","5","27","{""PRON"": 8, ""VERB"": 16, ""ADP"": 10, ""DET"": 4, ""NOUN"": 18, ""PRT"": 4, ""."": 4, ""ADJ"": 7, ""ADV"": 3, ""NUM"": 2, ""CONJ"": 1}"
"473","Six","7","'We wanted to talk about coaching Ali,' Ish began after Ali left the room with his mom.","19","1","6","{""ADV"": 1, ""VERB"": 4, ""PRT"": 1, ""ADP"": 3, ""NOUN"": 6, ""."": 2, ""DET"": 1, ""PRON"": 1}"
"474","Six","8","'Cricket coaching?  No,  thanks.  We are  not  interested,' Ali's dad said  in a tone that was more conclusive than discussion oriented.","25","3","8","{""NOUN"": 7, ""VERB"": 5, ""."": 3, ""PRON"": 1, ""ADV"": 2, ""ADJ"": 2, ""PRT"": 1, ""ADP"": 2, ""DET"": 2}"
"475","Six","9","'But uncle...,' Ish protested.","7","1","0","{""NUM"": 1, ""NOUN"": 2, ""."": 3, ""VERB"": 1}"
"476","Six","10","'Look above,'  Ali's dad  said and  pointed to the roof, 'look, there  are cracks on the ceiling. There is this room and one other tiny room that I have taken on rent.","37","2","15","{""NUM"": 2, ""ADP"": 4, ""."": 5, ""NOUN"": 8, ""PRT"": 2, ""VERB"": 6, ""CONJ"": 2, ""DET"": 5, ""ADJ"": 2, ""PRON"": 1}"
"477","Six","11","Does it look like the house of a person who can afford cricket coaching?' 'We won't be charging Ali,' Ish said.","25","2","7","{""VERB"": 9, ""PRON"": 2, ""ADP"": 2, ""DET"": 2, ""NOUN"": 6, ""."": 3, ""ADV"": 1}"
"478","Six","12","I glared at Ish. I hate it when he gives discounts at the shop, but a hundred per cent off is insane.","23","2","10","{""PRON"": 4, ""VERB"": 4, ""ADP"": 3, ""NOUN"": 5, ""ADV"": 1, ""DET"": 2, ""."": 1, ""CONJ"": 1, ""ADJ"": 2}"
"479","Six","13","'What will he do with cricket coaching? Already school is difficult for him after the madrasa. This is the first time Ali is studying maths. And I can't even afford a maths tutor...' 'Govind teaches maths,' Ish said.","43","4","13","{""DET"": 5, ""VERB"": 10, ""PRON"": 3, ""ADP"": 3, ""NOUN"": 10, ""ADJ"": 4, ""CONJ"": 1, ""ADV"": 2, ""."": 3, ""PRT"": 2}"
"480","Six","14","'What?' Ali's dad and I said together.","9","2","1","{""DET"": 1, ""."": 1, ""NOUN"": 2, ""PRT"": 1, ""CONJ"": 1, ""PRON"": 1, ""VERB"": 1, ""ADV"": 1}"
"481","Six","15","'Really,  he  is  the  best  in  Belrampur.  He  got  hundred  per  cent  marks  in  the Class XII board exam.' I  double  glared  at Ish.  I  was  fully  booked  in  tuitions  and  I  already  taught  his clown of a sister for free. 'But Ish, I can't,' I said.","53","5","14","{""ADV"": 5, ""."": 5, ""PRON"": 8, ""VERB"": 9, ""DET"": 3, ""ADJ"": 2, ""ADP"": 7, ""NOUN"": 12, ""CONJ"": 1, ""NUM"": 1}"
"482","Six","16","'Maybe we can do a combined deal. If you allow him cricket coaching with us, we will teach him maths for free,' Ish said ignoring my words.","30","2","12","{""ADP"": 4, ""PRON"": 7, ""VERB"": 8, ""DET"": 1, ""ADJ"": 2, ""NOUN"": 5, ""."": 3}"
"483","Six","17","'How can I teach for free? I have paying students waiting,' I said.","15","2","3","{""NUM"": 1, ""VERB"": 6, ""PRON"": 3, ""ADP"": 1, ""ADJ"": 1, ""NOUN"": 1, ""."": 2}"
"484","Six","18","Ish glanced at me with disdain as if I had shot down his mission to Mars.","16","1","9","{""NOUN"": 4, ""VERB"": 3, ""ADP"": 4, ""PRON"": 3, ""PRT"": 2}"
"485","Six","19","'For free?' I mouthed to him.","7","2","2","{""NUM"": 1, ""ADJ"": 1, ""PRT"": 2, ""PRON"": 2, ""VERB"": 1}"
"486","Six","20","'I will pay whatever I can,' Ali's dad said in a muffled voice.","17","1","4","{""."": 3, ""PRON"": 2, ""VERB"": 4, ""DET"": 2, ""NOUN"": 3, ""PRT"": 1, ""ADP"": 1, ""ADJ"": 1}"
"487","Six","21","'I  am  sorry,  but  this  is  how  I  earn  my  living.  I  can't...'  I  said,  in  a  desperate attempt to salvage my asshole image.","30","2","10","{""PRT"": 2, ""PRON"": 6, ""VERB"": 6, ""ADJ"": 3, ""."": 4, ""CONJ"": 1, ""DET"": 2, ""ADV"": 2, ""NOUN"": 3, ""ADP"": 1}"
"488","Six","22","'Just  take  it  from  my  salary,  ok?  Can  you  let  me  talk?'  Ish  said  with  great politeness.","19","3","6","{""NOUN"": 4, ""VERB"": 5, ""PRON"": 5, ""ADP"": 2, ""."": 2, ""ADJ"": 1}"
"489","Six","23","I wanted to get up and leave.","7","1","3","{""PRON"": 1, ""VERB"": 3, ""PRT"": 2, ""CONJ"": 1}"
"490","Six","24","I get a small retirement pension. How much do you charge?' 'Four hun...,' I started to say but Ish interrupted with 'Why don't we start and see how it goes?' Everyone nodded, even Omi because he did whatever everyone else was doing anyway.","50","4","16","{""PRON"": 6, ""VERB"": 15, ""DET"": 1, ""ADJ"": 1, ""NOUN"": 8, ""ADV"": 7, ""."": 6, ""NUM"": 1, ""PRT"": 1, ""CONJ"": 2, ""ADP"": 2}"
"491","Six","25","'Right, Govind?' he said to me last.","9","2","3","{""NUM"": 1, ""."": 1, ""NOUN"": 1, ""PRT"": 2, ""PRON"": 2, ""VERB"": 1, ""ADJ"": 1}"
"492","Six","26","I gave the briefest nod possible, a five-degree tilt.","10","1","2","{""PRON"": 1, ""VERB"": 1, ""DET"": 2, ""ADJ"": 3, ""NOUN"": 2, ""."": 1}"
"493","Six","27","'Stay for dinner, please,' Ali's dad implored as we stood up to leave.","17","1","5","{""NOUN"": 5, ""ADP"": 2, ""."": 3, ""PRT"": 3, ""VERB"": 3, ""PRON"": 1}"
"494","Six","28","'No, no,' Omi said, horrified at the idea of eating in a Muslim home.","18","1","6","{""NUM"": 1, ""."": 4, ""DET"": 3, ""NOUN"": 4, ""VERB"": 3, ""ADP"": 3}"
"495","Six","29","'Please, I insist. For us, hospitality is important. You are our mehmaan.' I would have disagreed, but I wanted to get something for the free maths-and- cricket coaching programme.","33","4","8","{""NOUN"": 8, ""."": 4, ""PRON"": 6, ""VERB"": 8, ""ADP"": 2, ""ADJ"": 2, ""CONJ"": 1, ""PRT"": 1, ""DET"": 1}"
"496","Six","30","We  sat  on  the  living  room  floor.  Ali's  mom  brought  us  two  extra  large  plates, one  for  the  three  of  us  and  another  for  Ali's  dad.  The  plates  had  simple  food - chapattis, daal and a potato-cauliflower vegetable.","42","3","10","{""PRON"": 3, ""VERB"": 3, ""ADP"": 4, ""DET"": 5, ""NOUN"": 14, ""PRT"": 2, ""NUM"": 3, ""ADJ"": 3, ""."": 3, ""CONJ"": 2}"
"497","Six","31","Omi sat down. He did not touch the food.","9","2","4","{""NOUN"": 2, ""VERB"": 3, ""ADP"": 1, ""PRON"": 1, ""ADV"": 1, ""DET"": 1}"
"498","Six","32","'Sorry I can't offer you meat. This is all we have today.' 'I don't eat meat. I am a priest's son,' Omi said.","30","4","8","{""NOUN"": 6, ""PRON"": 5, ""VERB"": 9, ""ADV"": 2, ""DET"": 3, ""."": 3, ""PRT"": 2}"
"499","Six","33","An awkward pause followed. Ish jumped in, 'The food looks great. Dig in guys.' To  share  a  single  plate  is  strangely  intimate,  lsh  and  I broke  off  the  same chapatti.  His long  fingers reminded me  of his sister's. Damn,  I had  to teach her again the next day.","53","6","16","{""DET"": 4, ""NOUN"": 12, ""VERB"": 9, ""ADP"": 3, ""."": 4, ""ADJ"": 7, ""PRT"": 5, ""ADV"": 2, ""CONJ"": 1, ""PRON"": 6}"
"500","Six","34","'They don't teach maths in madrasas?' I asked for the sake of conversation and mathematics.","17","2","6","{""NOUN"": 6, ""VERB"": 3, ""ADV"": 1, ""ADP"": 3, ""."": 1, ""PRON"": 1, ""DET"": 1, ""CONJ"": 1}"
"501","Six","35","'Not in this one,' Ali's dad said as he spooned in daal. 'Maths and science are forbidden.' 'That's  strange.  In  this  day  and  age,'  I  said.  I  thought  of  a  business opportunity, a massive maths tuition chain outside every madrasa.","48","5","12","{""NOUN"": 13, ""ADP"": 6, ""DET"": 5, ""NUM"": 1, ""."": 6, ""PRT"": 1, ""VERB"": 7, ""PRON"": 4, ""ADJ"": 3, ""CONJ"": 2}"
"502","Six","36","'Not  really,'  Ali's  dad  said.  'Madrasas  were  not  even  supposed  to  be  schools.","16","2","4","{""PRT"": 3, ""ADV"": 3, ""."": 2, ""NOUN"": 4, ""VERB"": 4}"
"503","Six","37","Their  role  is  confined  to  teaching  Islamic  culture.  Here,  have  some  more chapattis.' 'And that's why you had him switch schools?' lsh said.","27","4","10","{""PRON"": 3, ""NOUN"": 6, ""VERB"": 8, ""PRT"": 3, ""ADJ"": 2, ""ADV"": 2, ""."": 1, ""DET"": 2}"
"504","Six","38","'Yes.  I  would  have  done  it  earlier,  but  my  father  was  adamant  Ali  goes  to  a madrasa. He died six months ago.' 'Oh, I am sorry,' Ish said.","33","4","8","{""NOUN"": 6, ""PRON"": 5, ""VERB"": 8, ""ADV"": 2, ""."": 5, ""CONJ"": 1, ""ADJ"": 1, ""PRT"": 1, ""DET"": 1, ""NUM"": 2, ""ADP"": 1}"
"505","Six","39","'He  was  unwell  for  a  long  time.  I  miss  him,  but  not  the  years  of  medical expenses that wiped me out,' Ali's father said. He drank a glass of water. 'When I retired from university, I had to leave the campus quarters. The party wanted me to move here. The Belrampur Municipal School was close, so I put him there. Is it good?' 'Yes, we studied there for twelve years,' I said.","82","8","28","{""NOUN"": 17, ""VERB"": 16, ""ADV"": 4, ""ADP"": 6, ""DET"": 9, ""ADJ"": 3, ""PRON"": 12, ""."": 9, ""CONJ"": 1, ""PRT"": 5}"
"506","Six","40","'Omi, you didn't eat anything. At least have some fruit,' Ali's dad said, offering him some bananas. Omi took one, examined it, and gobbled it in three bites.","36","3","10","{""NUM"": 3, ""."": 6, ""PRON"": 4, ""VERB"": 8, ""ADV"": 1, ""NOUN"": 7, ""ADP"": 2, ""ADJ"": 1, ""DET"": 2, ""PRT"": 1, ""CONJ"": 1}"
"507","Six","41","'Why are you so keen to teach Ali cricket?' Ali's dad said.","14","2","4","{""NOUN"": 5, ""VERB"": 4, ""PRON"": 1, ""ADV"": 1, ""PRT"": 2, ""."": 1}"
"508","Six","42","The question was enough to light up Ish's face. He spoke animatedly. 'Ali has a gift. You see how he blossoms with my training.' 'You play cricket?' Ali's father said.","34","6","9","{""DET"": 2, ""NOUN"": 9, ""VERB"": 8, ""ADJ"": 1, ""PRT"": 5, ""PRON"": 4, ""ADV"": 2, ""ADP"": 1, ""."": 2}"
"509","Six","43","'In  school  and  now  I  have  a  sports  store.  I've  seen  players,  but  none  like  Ali,' Ish said passionately.","23","2","5","{""ADJ"": 1, ""NOUN"": 7, ""CONJ"": 2, ""ADV"": 2, ""PRON"": 2, ""VERB"": 4, ""DET"": 1, ""."": 3, ""ADP"": 1}"
"510","Six","44","'But it's just  a  game.  One guy hits  a  ball with a stick,  the rest run around  to stop it.' 'It's  more  than  that,'  lsh  said, offended.  'But  if  you  have  never  played  it,  you will never understand.' Ali's dad said, 'You know I am a member of the secular party?' 'We saw the sign,' I said.","71","6","23","{""ADP"": 5, ""PRON"": 8, ""VERB"": 15, ""ADV"": 4, ""DET"": 8, ""NOUN"": 12, ""NUM"": 1, ""."": 11, ""PRT"": 5, ""ADJ"": 2}"
"511","Six","45","'Would you like to come and visit our party sometime?' Omi  suddenly  stood  up.  'Do  you  know  who you  are  talking  to?  I  am  Pandit Shastri's  son.  You  have  seen  the  Swami  temple  in  Belrampur  or  not?'  His  voice was loud.","44","6","17","{""VERB"": 11, ""PRON"": 8, ""ADP"": 2, ""PRT"": 5, ""CONJ"": 2, ""NOUN"": 9, ""ADV"": 3, ""NUM"": 1, ""DET"": 1, ""."": 1, ""ADJ"": 1}"
"512","Six","46","Ish pulled Omi's elbow to make him sit down.","10","1","3","{""NOUN"": 3, ""VERB"": 3, ""PRT"": 3, ""PRON"": 1}"
"513","Six","47","'How does that matter, son?' Ali's dad said.","11","2","2","{""NOUN"": 5, ""VERB"": 2, ""ADP"": 1, ""."": 2, ""PRT"": 1}"
"514","Six","48","'You are telling me to come visit your party? I am a Hindu.' 'We won't hold that against you,' Ali's father grinned. 'Ours is a secular party.' 'It  is not secular. It is suck-ular  party.  Suck-up  politics, that is  all you  know.","49","7","18","{""NOUN"": 10, ""VERB"": 12, ""PRON"": 6, ""PRT"": 4, ""X"": 1, ""DET"": 5, ""ADV"": 2, ""ADP"": 1, ""."": 4, ""ADJ"": 4}"
"515","Six","49","No wonder Muslims like you flock there. Now Ish, we are leaving or not?' 'Omi, behave yourself, we came for Ali.' I don't  care.  Let  him  play  marbles  and  fail  maths. If  Bittoo  Mama  finds  out I am here...' 'Bittoo is your Mama?' Ali's dad said.","56","7","17","{""DET"": 1, ""NOUN"": 12, ""ADP"": 3, ""PRON"": 8, ""VERB"": 14, ""ADV"": 5, ""."": 7, ""CONJ"": 2, ""PRT"": 4}"
"516","Six","50","'He is your opposition. And a suck-up party will never win in Belrampur.' 'Calm down, son. Sit down,' Ali's dad said.","26","4","7","{""."": 4, ""VERB"": 4, ""PRON"": 1, ""NOUN"": 7, ""CONJ"": 1, ""DET"": 1, ""ADJ"": 1, ""ADV"": 2, ""ADP"": 2, ""PRT"": 3}"
"517","Six","51","Omi sat down and Ish massaged his shoulder. Omi rarely flared up, but when he did, it took several pacifying tactics to get him back to normal.","29","2","12","{""NOUN"": 5, ""VERB"": 7, ""ADV"": 4, ""CONJ"": 2, ""PRON"": 4, ""PRT"": 3, ""."": 2, ""ADJ"": 2}"
"518","Six","52","'Here, have a banana. I know you are hungry,' Ish soothed.","14","2","4","{""ADV"": 1, ""."": 3, ""VERB"": 4, ""DET"": 1, ""NOUN"": 2, ""PRON"": 2, ""ADJ"": 1}"
"519","Six","53","Omi resisted, but took the banana.","7","1","2","{""NOUN"": 2, ""VERB"": 2, ""."": 1, ""CONJ"": 1, ""DET"": 1}"
"520","Six","54","'I am also new to secular politics, son. I was in a hardline party,' Ali's dad said and paused to reflect, 'yes, I made a few mistakes too.' 'Whatever. Don't even try to convert people from our party to yours,' Omi said fiercely.","54","4","15","{""PRT"": 6, ""PRON"": 5, ""VERB"": 11, ""ADV"": 5, ""ADJ"": 3, ""NOUN"": 10, ""."": 8, ""ADP"": 2, ""DET"": 2, ""CONJ"": 1, ""X"": 1}"
"521","Six","55","I won't.  But  why  are  you  so  against  us?  The  party  has  ruled  the  country  for forty years, we must be doing something right.' 'You won't rule Gujarat anymore. Because we can see through your hypocrisy,' Omi said.","44","5","15","{""PRON"": 6, ""VERB"": 12, ""ADV"": 6, ""CONJ"": 1, ""ADP"": 4, ""DET"": 2, ""NOUN"": 8, ""ADJ"": 1, ""."": 3, ""PRT"": 1}"
"522","Six","56","'Omi, stop,' Ish said.","7","1","0","{""NUM"": 1, ""."": 3, ""NOUN"": 2, ""VERB"": 1}"
"523","Six","57","'It's ok, Ish. I rarely get young people to talk to. Let him speak his mind,' Ali's dad said.","24","3","4","{""NOUN"": 7, ""PRT"": 4, ""."": 3, ""PRON"": 3, ""ADV"": 1, ""VERB"": 5, ""ADJ"": 1}"
"524","Six","58","I don't have anything to say. Let's go,' Omi said.","14","2","3","{""PRON"": 1, ""VERB"": 5, ""ADV"": 1, ""NOUN"": 3, ""PRT"": 2, ""."": 2}"
"525","Six","59","'The communal parties aren't perfect either,' Ali's dad said.","13","1","1","{""PRT"": 2, ""ADJ"": 2, ""NOUN"": 3, ""VERB"": 2, ""ADV"": 2, ""."": 2}"
"526","Six","60","I guess even Ali's dad loved to argue.","9","1","1","{""PRON"": 1, ""VERB"": 3, ""ADV"": 1, ""NOUN"": 2, ""PRT"": 2}"
"527","Six","61","'There  you  go.  Here  is  the  bias,  you  call us  communal.  Your  party  gives preference  to  Muslims,  but  it  is  secular.  Why?'  Omi  said.  'What  preference  have we given?' Ali's dad said. 'Why can't you let us make a temple in Ayodhya?' Omi said. 'Because there is a mosque there already' 'But there was a temple there before.' 'That is not proven.' 'It has. The government keeps hiding those reports.' 'Incorrect.' 'Whatever. It is not an ordinary place. We believe it is the birthplace of our lord.","99","17","34","{""ADV"": 9, ""PRON"": 14, ""VERB"": 23, ""DET"": 10, ""NOUN"": 21, ""."": 7, ""ADJ"": 3, ""PRT"": 6, ""CONJ"": 1, ""ADP"": 4, ""NUM"": 1}"
"528","Six","62","We said, ""Give us that site, and we will move the mosque respectfully next door."" But you can't even do that. And we, the majority, can't have that one little request fulfilled. Parekh-ji is right, what hope does a Hindu have in this country?' 'Oh, so it is Parekh-ji. He taught you all this?' Ali's dad almost smirked.","71","7","25","{""PRON"": 9, ""VERB"": 15, ""."": 10, ""ADP"": 3, ""NOUN"": 11, ""CONJ"": 3, ""DET"": 8, ""ADV"": 5, ""ADJ"": 4, ""NUM"": 2, ""PRT"": 1}"
"529","Six","63","'He  didn't  teach  us.  Our  cause  is  labelled  communal,  it  is  not  Cool  to  talk about it. But because Hindus don't talk, you think they don't feel anything? Why do  you  think  people  listen  to  Parekh-ji?  because  somewhere  deep  down,  he strikes a chord. A common chord of resentment is brewing Mr Naseer, even if it is not talked about' A lot of Hindus vote for us, you should know,' Ali's father said.","85","6","31","{""NOUN"": 18, ""VERB"": 22, ""ADV"": 9, ""PRON"": 11, ""ADJ"": 3, ""."": 8, ""PRT"": 3, ""ADP"": 8, ""CONJ"": 1, ""DET"": 2}"
"530","Six","64","'But slowly they will see the truth.' 'Son, India is a free country. You have a right to your views. My only advice is Hinduism is a great religion, but don't get extreme.' 'Hah, don't tell me about being extreme. We know which religion is extreme.' I wasn't sure if Omi really believed in what he said, or if he was revising lessons given  by  Parekh-ji.  He  never  spoke  about  this  to  Ish  and  me,  but,  somewhere deep down, did he also feel like Bittoo Mama? If Ish's passion was cricket and my passion  was  business,  was  Omi's  passion  religion?  Or  maybe,  like  most  people, he  was  confused  and  trying  to  find  his  passion.  And  unlike  us  who  never  took him seriously, perhaps Parekh-ji gave him a sense of purpose and importance.","151","11","57","{""X"": 1, ""ADV"": 12, ""PRON"": 20, ""VERB"": 31, ""DET"": 7, ""NOUN"": 32, ""PRT"": 7, ""."": 13, ""ADJ"": 9, ""CONJ"": 8, ""ADP"": 11}"
"531","Six","65","'Can we please make a pact to not discuss politics?' Ish pleaded as he signalled a timeout.","18","2","7","{""VERB"": 6, ""PRON"": 2, ""DET"": 2, ""NOUN"": 4, ""PRT"": 2, ""ADV"": 1, ""ADP"": 1}"
"532","Six","66","'You  still  fine  with  sending  your  son?'  I  asked  Ali's  dad,  wondering  if  he  had changed his mind after Omi's outbursts.","25","2","7","{""NOUN"": 7, ""ADV"": 1, ""VERB"": 6, ""ADP"": 3, ""PRON"": 4, ""."": 2, ""PRT"": 2}"
"533","Six","67","'Don't be silly. We are communicating our differences. That is what is missing in this country. It's ok, I trust you with my son.' | We stood up to leave and reached the door, lsh confirmed the practice time - 7 a.m.","47","5","16","{""VERB"": 13, ""ADV"": 2, ""PRON"": 8, ""NOUN"": 9, ""DET"": 4, ""ADP"": 2, ""ADJ"": 1, ""."": 4, ""PRT"": 2, ""CONJ"": 1, ""NUM"": 1}"
"534","Six","68","'Come, I will walk you boys to the main road. I like to take a walk after dinner,' Ali's dad said.","25","2","7","{""NUM"": 1, ""."": 3, ""PRON"": 3, ""VERB"": 6, ""PRT"": 3, ""DET"": 2, ""ADJ"": 1, ""NOUN"": 5, ""ADP"": 1}"
"535","Six","69","We  walked  out  of  Ali's  house.  Omi  held  his  head  down,  probably  feeling ashamed at having raised his voice. Ali's dad spoke again. 'I am not particularly fond of my own party' 'Really?' I said when no one said anything.","46","5","15","{""PRON"": 6, ""VERB"": 10, ""ADP"": 4, ""NOUN"": 12, ""PRT"": 6, ""."": 1, ""ADV"": 5, ""ADJ"": 1, ""DET"": 1}"
"536","Six","70","'Yes,  because  at  one  level,  they  too,  like  all  political  parties,  spend  more  time playing  politics  than  working  for  the  country.  Creating  differences,  taking  sides, causing divides - they know this too well.' All of us nodded to say goodnight. But Ali's dad was not finished. 'It is like two customers go to a restaurant and the manager gives them only one plate of food.","73","5","24","{""NOUN"": 18, ""."": 8, ""ADP"": 8, ""NUM"": 3, ""PRON"": 4, ""ADV"": 5, ""DET"": 6, ""ADJ"": 2, ""VERB"": 13, ""PRT"": 4, ""CONJ"": 2}"
"537","Six","71","And  if  you  want  to  eat,  you  must  fight  the  other  guy.  The  two guys  get  busy fighting,  and  some people  tell  them  to  make  amends  and  eat  half  plate  each.  In all this, they forget the real issue - why didn't the manager provide-two plates of food?' I  noticed  Ali's  dad's  face.  Behind  the  beard  and  the  moustache,  there was  a wise man somewhere.","73","5","26","{""CONJ"": 4, ""ADP"": 4, ""PRON"": 5, ""VERB"": 12, ""PRT"": 4, ""."": 6, ""DET"": 12, ""ADJ"": 4, ""NOUN"": 18, ""NUM"": 1, ""ADV"": 3}"
"538","Six","72","'Good  point,  the  fight  is  created.  That  is  why  I  am  never  big  on  religion  or politics,' I said.","22","2","7","{""NOUN"": 5, ""."": 3, ""DET"": 2, ""VERB"": 5, ""ADV"": 2, ""PRON"": 2, ""ADJ"": 1, ""ADP"": 1, ""CONJ"": 1}"
"539","Six","73","'Once a fight  is created,  it leads to another and so on.  Youl can't  really check it,' lsh said.","23","2","8","{""VERB"": 7, ""DET"": 2, ""NOUN"": 3, ""."": 3, ""PRON"": 2, ""PRT"": 1, ""CONJ"": 1, ""ADV"": 3, ""ADP"": 1}"
"540","Six","74","'You  know  I  used  to  teach  zoology  in  college,'  Ali's  dad  said.  'And  I  once  read about chimpanzee fights that may be relevant here.' 'Chimpanzee fights?' 'Yes,  male  chimpanzees  of  the  same  pack  fight  violently  with  each  other - for food, females, whatever. However, after the fight, they go through a strange ritual.","63","5","19","{""NOUN"": 14, ""VERB"": 8, ""PRON"": 3, ""PRT"": 4, ""ADP"": 7, ""."": 9, ""ADV"": 4, ""ADJ"": 8, ""DET"": 6}"
"541","Six","75","They kiss each other, on the lips.' Even Omi had to laugh.","14","2","6","{""PRON"": 1, ""VERB"": 3, ""DET"": 2, ""ADJ"": 1, ""."": 1, ""ADP"": 1, ""NOUN"": 2, ""PRT"": 2, ""ADV"": 1}"
"542","Six","76","'So Hindus and Muslims should kiss?' I said.","9","2","2","{""PRT"": 2, ""NOUN"": 2, ""CONJ"": 1, ""VERB"": 3, ""PRON"": 1}"
"543","Six","77","'No, the point is this ritual was created by nature. To make sure the fight gets resolved and the pack stays together. In fact, any long-term relationship requires this.' 'Any?' Ish said.","36","5","10","{""NUM"": 1, ""."": 3, ""DET"": 6, ""NOUN"": 8, ""VERB"": 9, ""ADP"": 2, ""PRT"": 3, ""ADJ"": 2, ""CONJ"": 1, ""ADV"": 1}"
"544","Six","78","'Yes,  take  any  husband  and  wife.  They  will  fight,  and  hurt  each  other emotionally.  However,  later  they  will  make  up,  with  hugs,  presents  or  kind understanding  words.  These  reconciliatory  mechanisms are  essential.  The problem in Indian Hindu-Muslim rivalry is not that that one is right and the other is wrong. It is...","58","6","23","{""NUM"": 2, ""."": 6, ""VERB"": 11, ""DET"": 6, ""NOUN"": 10, ""CONJ"": 4, ""PRON"": 3, ""ADJ"": 8, ""ADV"": 4, ""PRT"": 1, ""ADP"": 3}"
